{
  "$schema": "https://json-schema.org/draft/2020-12/schema",
  "$id": "urn:jingtang:contract:content:approval:v1",
  "title": "Approval",
  "type": "object",
  "additionalProperties": false,
  "required": [
    "approval_id",
    "workspace_id",
    "content_id",
    "revision_id",
    "actor_user_id",
    "result",
    "reason",
    "decided_at"
  ],
  "properties": {
    "approval_id": { "type": "string", "format": "uuid" },
    "workspace_id": { "type": "string", "format": "uuid" },
    "content_id": { "type": "string", "format": "uuid" },
    "revision_id": { "type": "string", "format": "uuid" },
    "actor_user_id": { "type": "string", "format": "uuid" },
    "result": { "type": "string", "enum": ["approved", "rejected"] },
    "reason": { "type": ["string", "null"], "maxLength": 1000 },
    "decided_at": { "type": "string", "format": "date-time" }
  }
}
