{
  "approval_id": "77777777-7777-4777-8777-777777777777",
  "workspace_id": "22222222-2222-4222-8222-222222222222",
  "content_id": "33333333-3333-4333-8333-333333333333",
  "revision_id": "44444444-4444-4444-8444-444444444444",
  "actor_user_id": "88888888-8888-4888-8888-888888888888",
  "result": "rejected",
  "reason": "Please clarify the campaign title.",
  "decided_at": "2026-08-21T11:00:00.000Z"
}
